{
  "schema_version": "0.1.0",
  "proposal_id": "proposal-demo-mock-0001",
  "timestamp_utc": "2026-02-11T10:00:00Z",
  "author_type": "human",
  "backend": "mock",
  "model_script": "examples/openmodelica/minimal_probe.mos",
  "change_summary": "Deterministic demo flow without Docker dependency",
  "requested_actions": ["check", "simulate", "regress"],
  "risk_level": "low",
  "metadata": {
    "note": "demo"
  }
}
