{
  "schema_version": "0.1.0",
  "proposal_id": "proposal-0001",
  "timestamp_utc": "2026-02-11T10:00:00Z",
  "author_type": "human",
  "backend": "openmodelica_docker",
  "model_script": "examples/openmodelica/minimal_probe.mos",
  "change_summary": "Run baseline probe after parameter refactor",
  "requested_actions": ["check", "simulate", "regress"],
  "risk_level": "low",
  "metadata": {
    "branch": "main",
    "note": "sample proposal for validator"
  }
}
