{
  "schema_version": "0.1.0",
  "proposal_id": "proposal-checker-config-demo-0001",
  "timestamp_utc": "2026-02-13T10:00:00Z",
  "author_type": "human",
  "backend": "mock",
  "model_script": "examples/openmodelica/minimal_probe.mos",
  "change_summary": "Demo proposal for checker threshold configuration",
  "requested_actions": ["regress"],
  "risk_level": "low",
  "checkers": ["performance_regression", "event_explosion"],
  "checker_config": {
    "performance_regression": {
      "max_ratio": 1.5
    },
    "event_explosion": {
      "max_ratio": 1.5,
      "abs_threshold_if_baseline_zero": 50
    }
  }
}
