{
  "schema_version": "0.1.0",
  "proposal_id": "proposal-invariant-guard-demo-0001",
  "timestamp_utc": "2026-02-16T10:00:00Z",
  "author_type": "agent",
  "backend": "mock",
  "model_script": "examples/openmodelica/minimal_probe.mos",
  "change_summary": "demo proposal with physical invariants",
  "requested_actions": ["check", "regress"],
  "risk_level": "medium",
  "checkers": ["invariant_guard"],
  "physical_invariants": [
    {
      "type": "range",
      "metric": "steady_state_error",
      "min": 0.0,
      "max": 0.08
    },
    {
      "type": "monotonic",
      "metric": "energy",
      "direction": "non_increasing"
    },
    {
      "type": "bounded_delta",
      "metric": "overshoot",
      "max_abs_delta": 0.1
    }
  ]
}
